{
  "schema_version": "ushso.ai-conflict-analysis.v1",
  "analysis_id": "conflict:5c7dcb3430606da719e46e539592a22c",
  "request_id": "conflict-request:scale-roster-bed:2026-07-17",
  "review_tier": "ordinary_material_claim",
  "review_refs": [
    {
      "review_id": "review:c2882aa0c89fe6d4be27517f1c034a92",
      "output_sha256": "sha256:8779b4271bae0d9b430e9a353287d23addc48318f23c6e1765cb38206d6b84af"
    },
    {
      "review_id": "review:5f079b05abb74e38b1354bda9cd7b863",
      "output_sha256": "sha256:2e54bc3b44292481c621e8e7b0dd07d57d174073441f90611dcc31c7437eeade"
    }
  ],
  "discrepancies": [
    {
      "discrepancy_id": "discrepancy:4d682970c79dc0aaf41da05b",
      "type": "warrant_or_posture_mapping",
      "field_path": "posture_assessments.acquire.evidence_refs",
      "material": true,
      "positions": [
        {
          "review_id": "review:c2882aa0c89fe6d4be27517f1c034a92",
          "value": [
            "computation:scale-v1:all-six:no-score:2026-07-16",
            "conflict:chestnut-hill-ownership-and-bases"
          ]
        },
        {
          "review_id": "review:5f079b05abb74e38b1354bda9cd7b863",
          "value": [
            "computation:scale-v1:all-six:no-score:2026-07-16",
            "conflict:christianacare-shared-cms-reporting-entity",
            "conflict:chestnut-hill-ownership-and-bases"
          ]
        }
      ],
      "deterministic_resolution": null,
      "human_route_required": true
    },
    {
      "discrepancy_id": "discrepancy:0eb225d3304a1c859d58de1d",
      "type": "warrant_or_posture_mapping",
      "field_path": "posture_assessments.acquire.rationale",
      "material": true,
      "positions": [
        {
          "review_id": "review:c2882aa0c89fe6d4be27517f1c034a92",
          "value": "An incomplete packet and unresolved ownership/basis questions do not establish transaction suitability."
        },
        {
          "review_id": "review:5f079b05abb74e38b1354bda9cd7b863",
          "value": "The no-score result and unresolved ownership boundaries create diligence questions, not acquisition evidence."
        }
      ],
      "deterministic_resolution": null,
      "human_route_required": true
    },
    {
      "discrepancy_id": "discrepancy:634f1d72b17974686d49eae0",
      "type": "warrant_or_posture_mapping",
      "field_path": "posture_assessments.acquire.limitation",
      "material": true,
      "positions": [
        {
          "review_id": "review:c2882aa0c89fe6d4be27517f1c034a92",
          "value": "Transaction, valuation, governance, control, integration, and forecast evidence are absent. This assessment does not recommend a posture."
        },
        {
          "review_id": "review:5f079b05abb74e38b1354bda9cd7b863",
          "value": "Transaction scope, control, workforce, achievable capacity, integration, finance, regulation, and demand are absent. This assessment does not recommend a posture."
        }
      ],
      "deterministic_resolution": null,
      "human_route_required": true
    },
    {
      "discrepancy_id": "discrepancy:6ffc96fe52b63ea30c62aa93",
      "type": "warrant_or_posture_mapping",
      "field_path": "posture_assessments.merge_affiliate.evidence_refs",
      "material": true,
      "positions": [
        {
          "review_id": "review:c2882aa0c89fe6d4be27517f1c034a92",
          "value": [
            "computation:scale-v1:all-six:no-score:2026-07-16",
            "conflict:christianacare-shared-cms-reporting-entity"
          ]
        },
        {
          "review_id": "review:5f079b05abb74e38b1354bda9cd7b863",
          "value": [
            "computation:scale-v1:all-six:no-score:2026-07-16",
            "conflict:temple-shared-cms-reporting-entity",
            "conflict:chestnut-hill-ownership-and-bases"
          ]
        }
      ],
      "deterministic_resolution": null,
      "human_route_required": true
    },
    {
      "discrepancy_id": "discrepancy:54d7fc175077024652d2cc21",
      "type": "warrant_or_posture_mapping",
      "field_path": "posture_assessments.merge_affiliate.rationale",
      "material": true,
      "positions": [
        {
          "review_id": "review:c2882aa0c89fe6d4be27517f1c034a92",
          "value": "Shared reporting entities demonstrate a measurement problem, not affiliation feasibility or benefit."
        },
        {
          "review_id": "review:5f079b05abb74e38b1354bda9cd7b863",
          "value": "Shared reporting and joint ownership prevent a clean comparison and do not establish affiliation feasibility."
        }
      ],
      "deterministic_resolution": null,
      "human_route_required": true
    },
    {
      "discrepancy_id": "discrepancy:d30d1e56e8782a21c8b89ac8",
      "type": "warrant_or_posture_mapping",
      "field_path": "posture_assessments.merge_affiliate.limitation",
      "material": true,
      "positions": [
        {
          "review_id": "review:c2882aa0c89fe6d4be27517f1c034a92",
          "value": "Governance, control, affiliation, finance, capability, and implementation evidence are absent. This assessment does not recommend a posture."
        },
        {
          "review_id": "review:5f079b05abb74e38b1354bda9cd7b863",
          "value": "Governance, operating model, workforce, referral, transfer, and integration constraints are absent. This assessment does not recommend a posture."
        }
      ],
      "deterministic_resolution": null,
      "human_route_required": true
    },
    {
      "discrepancy_id": "discrepancy:eafca07f29d08253c8853f17",
      "type": "warrant_or_posture_mapping",
      "field_path": "posture_assessments.partner.evidence_refs",
      "material": true,
      "positions": [
        {
          "review_id": "review:c2882aa0c89fe6d4be27517f1c034a92",
          "value": [
            "computation:scale-v1:all-six:no-score:2026-07-16",
            "coverage:bed-missing:jefferson-health:jefferson-abington-hospital"
          ]
        },
        {
          "review_id": "review:5f079b05abb74e38b1354bda9cd7b863",
          "value": [
            "computation:scale-v1:all-six:no-score:2026-07-16",
            "coverage:bed-missing:penn-medicine:hup-cedar",
            "conflict:cooper-childrens-separate-hospital"
          ]
        }
      ],
      "deterministic_resolution": null,
      "human_route_required": true
    },
    {
      "discrepancy_id": "discrepancy:55b29a8e56433bb039590bc3",
      "type": "warrant_or_posture_mapping",
      "field_path": "posture_assessments.partner.rationale",
      "material": true,
      "positions": [
        {
          "review_id": "review:c2882aa0c89fe6d4be27517f1c034a92",
          "value": "Missing facility crosswalks and Scale inputs cannot establish complementary capacity, demand, access, or partnership value."
        },
        {
          "review_id": "review:5f079b05abb74e38b1354bda9cd7b863",
          "value": "Campus and specialty ambiguity does not show complementary operational capacity or executable access pathways."
        }
      ],
      "deterministic_resolution": null,
      "human_route_required": true
    },
    {
      "discrepancy_id": "discrepancy:b94cb65cb1ecc8ae8f8d4f7c",
      "type": "warrant_or_posture_mapping",
      "field_path": "posture_assessments.partner.limitation",
      "material": true,
      "positions": [
        {
          "review_id": "review:c2882aa0c89fe6d4be27517f1c034a92",
          "value": "Service-line, referral, utilization, workforce, access, and partnership evidence are absent. This assessment does not recommend a posture."
        },
        {
          "review_id": "review:5f079b05abb74e38b1354bda9cd7b863",
          "value": "Demand, staffed capacity, scheduling, transfer, referral, and workforce evidence are absent. This assessment does not recommend a posture."
        }
      ],
      "deterministic_resolution": null,
      "human_route_required": true
    },
    {
      "discrepancy_id": "discrepancy:11e607807a374ecc0593a0b8",
      "type": "warrant_or_posture_mapping",
      "field_path": "posture_assessments.compete.evidence_refs",
      "material": true,
      "positions": [
        {
          "review_id": "review:c2882aa0c89fe6d4be27517f1c034a92",
          "value": [
            "computation:scale-v1:all-six:no-score:2026-07-16",
            "conflict:union-bed-bases",
            "conflict:temple-shared-cms-reporting-entity"
          ]
        },
        {
          "review_id": "review:5f079b05abb74e38b1354bda9cd7b863",
          "value": [
            "computation:scale-v1:all-six:no-score:2026-07-16",
            "union-official-103",
            "md-bed:union:licensed-fy2026",
            "cms-hcris:210032:number-of-beds"
          ]
        }
      ],
      "deterministic_resolution": null,
      "human_route_required": true
    },
    {
      "discrepancy_id": "discrepancy:eefc31253b47f4f96a671172",
      "type": "warrant_or_posture_mapping",
      "field_path": "posture_assessments.compete.rationale",
      "material": true,
      "positions": [
        {
          "review_id": "review:c2882aa0c89fe6d4be27517f1c034a92",
          "value": "Noncomparable bed definitions, periods, and reporting entities cannot support relative scale or competitive position."
        },
        {
          "review_id": "review:5f079b05abb74e38b1354bda9cd7b863",
          "value": "Different bed bases and periods cannot establish operational scale, access, throughput, or competitive capacity."
        }
      ],
      "deterministic_resolution": null,
      "human_route_required": true
    },
    {
      "discrepancy_id": "discrepancy:2a28ffc858ca008fae174c05",
      "type": "warrant_or_posture_mapping",
      "field_path": "posture_assessments.compete.limitation",
      "material": true,
      "positions": [
        {
          "review_id": "review:c2882aa0c89fe6d4be27517f1c034a92",